{
  "$schema": "https://schemas.wp.org/trunk/block.json",
  "apiVersion": 3,
  "name": "joo/not-found",
  "title": "Not found (terminal)",
  "category": "joo",
  "description": "A terminal-style 404 view with a transcript, search and suggestions.",
  "textdomain": "joo-core",
  "attributes": {},
  "supports": { "html": false, "align": ["wide", "full"] }
}
